{
  "id": 1,
  "uid": "1296269",
  "user_id": 1,
  "namespace": "octocat",
  "name": "hello-world",
  "slug": "octocat/hello-world",
  "scm": "github",
  "git_http_url": "https://github.com/octocat/hello-world.git",
  "git_ssh_url": "git@github.com:octocat/hello-world.git",
  "link": "https://github.com/octocat/hello-world",
  "default_branch": "main",
  "private": false,
  "visibility": "public",
  "active": true,
  "config_path": ".drone.yml",
  "trusted": false,
  "protected": false,
  "ignore_forks": false,
  "ignore_pull_requests": false,
  "auto_cancel_pull_requests": true,
  "auto_cancel_pushes": false,
  "auto_cancel_running": false,
  "throttle": 0,
  "timeout": 60,
  "counter": 42,
  "synced": 1716000000,
  "created": 1700000000,
  "updated": 1716000000,
  "version": 5
}
